word,definition,part of speech
carp,"to annoy, pester (The husband divorced his wife after listening to her carpingvoice for decades.)catalog 1. (v.) to list, enter into a list (The judge cataloged the victim’s injuries before calculating how much money he would award.) 2. (n.) a list or collection (We received a catalog from J. Crew that displayed all of their new items.)",v.
catalyze,"to charge, inspire (The president’s speech catalyzed the nation and resuscitated the economy.)",v.
caucus,"a meeting usually held by people working toward the same goal (The ironworkers held a caucus to determine how much of a pay increase they would request.)",n.
caustic,"bitter, biting, acidic (The politicians exchanged caustic insults for over an hour during the debate.)",adj.
cavort,"to leap about, behave boisterously (The adults ate their dinners on the patio, while the children cavorted around the pool.)censure 1. (n.) harsh criticism (The frustrated teenager could not put up with anymore of her critical mother’s censure.) 2. (v.) to rebuke formally (The principal censuredthe head of the English Department for forcing students to learn esoteric vocabulary.)",v.
cerebral,"related to the intellect (The books we read in this class are too cerebral—they don’t engage my emotions at all.)",adj.
chaos,"absolute disorder (Mr. Thornton’s sudden departure for the lavatory plunged his classroom into chaos.)",n.
chastise,"to criticize severely (After being chastised by her peers for mimicking Britney Spears, Miranda dyed her hair black and affected a Gothic style.)",v.
cherish,"to feel or show affection toward something (She continued to cherish her red plaid trousers, even though they had gone out of style and no longer fit her.)",v.
chide,"to voice disapproval (Lucy chided Russell for his vulgar habits and sloppy appearance.)",v.
choreography,"the arrangement of dances (The plot of the musical was banal, but the choreography was stunning.)chronicle 1. (n.) a written history (The library featured the newly updated chronicle of World War II.) 2. (v.) to write a history (Albert’s diary chronicled the day-to-day growth of his obsession with Cynthia.)",n.
chronological,"arranged in order of time (Lionel carefully arranged the snapshots of his former girlfriends in chronological order, and then set fire to them.)",adj.
circuitous,"roundabout (The bus’s circuitous route took us through numerous outlying suburbs.)",adj.
circumlocution,"indirect and wordy language (The professor’s habit of speaking in circumlocutions made it difficult to follow his lectures.)",n.
circumscribed,"marked off, bounded (The children were permitted to play tag only within a carefully circumscribed area of the lawn.)",adj.
circumspect,"cautious (Though I promised Rachel’s father I would bring her home promptly by midnight, it would have been more circumspect not to have specified a time.)",adj.
circumvent,"to get around (The school’s dress code forbidding navel-baring jeans was circumvented by the determined students, who were careful to cover up with long coats when administrators were nearby.)",v.
clairvoyant,"able to perceive things that normal people cannot (Zelda’s uncanny ability to detect my lies was nothing short of clairvoyant.)clamor 1. (n.) loud noise (Each morning the birds outside my window make such a clamor that they wake me up.) 2. (v.)to loudly insist (Neville’s fans clamored for him to appear on stage, but he had passed out on the floor of his dressing room.)",adj.
clandestine,"secret (Announcing to her boyfriend that she was going to the gym, Sophie actually went to meet Joseph for a clandestine liaison.) cleave 1. (v.) to divide into parts (Following the scandalous disgrace of their leader, the entire political party cleaved into warring factions.) 2. (v.) to stick together firmly (After resolving their marital problems, Junior and Rosa cleaved to one another all the more tightly.)",adj.
clemency,"mercy (After he forgot their anniversary, Martin could only beg Maria for clemency.)",n.
clergy,"members of Christian holy orders (Though the villagers viewed the church rectory as quaint and charming, the clergy who lived there regarded it as a mildewy and dusty place that aggravated their allergies.)",n.
cloying,"sickeningly sweet (Though Ronald was physically attractive, Maud found his constant compliments and solicitous remarks cloying.)",adj.
coagulate,"to thicken, clot (The top layer of the pudding had coagulated into a thick skin.)",v.
coalesce,"to fuse into a whole (Gordon’s ensemble of thrift-shop garments coalescedinto a surprisingly handsome outfit.)",v.
cobbler,"a person who makes or repairs shoes (I had my neighborhood cobblerreplace my worn-out leather soles with new ones.)",n.
coerce,"to make somebody do something by force or threat (The court decided that Vanilla Ice did not have to honor the contract because he had been coerced into signing it.)",v.
cogent,"intellectually convincing (Irene’s arguments in favor of abstinence were so cogent that I could not resist them.)",adj.
cognizant,"aware, mindful (Jake avoided speaking to women in bars because he was cognizant of the fact that drinking impairs his judgment.)",adj.
coherent,"logically consistent, intelligible (Renee could not figure out what Monroe had seen because he was too distraught to deliver a coherent statement.)collateral 1. (adj.)secondary (Divorcing my wife had the collateral effect of making me poor, as she was the only one of us with a job or money.) 2. (n.) security for a debt (Jacob left his watch as collateral for the $500 loan.)",adj.
colloquial,"characteristic of informal conversation (Adam’s essay on sexual response in primates was marked down because it contained too many colloquialexpressions.)",adj.
collusion,"secret agreement, conspiracy (The three law students worked in collusionto steal the final exam.)",n.
colossus,"a gigantic statue or thing (For 56 years, the ancient city of Rhodes featured a colossus standing astride its harbor.)",n.
combustion,"the act or process of burning (The unexpected combustion of the prosecution’s evidence forced the judge to dismiss the case against Ramirez.)",n.
commendation,"a notice of approval or recognition (Jared received a commendationfrom Linda, his supervisor, for his stellar performance.)",n.
commensurate,"corresponding in size or amount (Ahab selected a very long roll and proceeded to prepare a tuna salad sandwich commensurate with his enormous appetite.)",adj.
commodious,"roomy (Holden invited the three women to join him in the back seat of the taxicab, assuring them that the car was quite commodious.)",adj.
compelling,"forceful, demanding attention (Eliot’s speech was so compelling that Lenore accepted his proposal on the spot.)",adj.
compensate,"to make an appropriate payment for something (Reginald bought Sharona a new dress to compensate her for the one he’d spilled his ice cream on.)",v.
complacency,"self-satisfied ignorance of danger (Colin tried to shock his friends out of their complacency by painting a frightening picture of what might happen to them.)",n.
complement,"to complete, make perfect (Ann’s scarf complements her blouse beautifully, making her seem fully dressed even though she isn’t wearing a coat.)",v.
compliant,"ready to adapt oneself to another’s wishes (Sue had very strong opinions about what to do on a first date, and Ted was absolutely compliant.)",adj.
complicit,"being an accomplice in a wrongful act (By keeping her daughter’s affair a secret, Maddie became complicit in it.)",adj.
compliment,"an expression of esteem or approval (I blushed crimson when Emma gave me a compliment on my new haircut.)compound 1. (v.) to combine parts (The difficulty of finding a fire escape amid the smoke was compounded with the dangers posed by the panicking crowds.) 2. (n.) a combination of different parts (My attraction to Donna was a compound of curiosity about the unknown, physical desire, and intellectual admiration.) 3. (n.) a walled area containing a group of buildings (When the fighting started, Joseph rushed into the family compound because it was safe and well defended.)",n.
comprehensive,"including everything (She sent me a comprehensive list of the ingredients needed to cook rabbit soufflé.)",adj.
compress,"to apply pressure, squeeze together (Lynn compressed her lips into a frown.)",v.
compunction,"distress caused by feeling guilty (He felt compunction for the shabby way he’d treated her.)",n.
concede,"to accept as valid (Andrew had to concede that what his mother said about Diana made sense.)",v.
conciliatory,"friendly, agreeable (I took Amanda’s invitation to dinner as a very conciliatory gesture.)",adj.
concise,"brief and direct in expression (Gordon did not like to waste time, and his instructions to Brenda were nothing if not concise.)",adj.
concoct,"to fabricate, make up (She concocted the most ridiculous story to explain her absence.)",v.
concomitant,"accompanying in a subordinate fashion (His dislike of hard work carried with it a concomitant lack of funds.)",adj.
concord,"harmonious agreement (Julie and Harold began the evening with a disagreement, but ended it in a state of perfect concord.)",n.
condolence,"an expression of sympathy in sorrow (Brian lamely offered his condolences on the loss of his sister’s roommate’s cat.)",n.
condone,"to pardon, deliberately overlook (He refused to condone his brother’s crime.)",v.
conduit,"a pipe or channel through which something passes (The water flowed through the conduit into the container.)",n.
confection,"a sweet, fancy food (We went to the mall food court and purchased a delicious confection.)",n.
confidant,"a person entrusted with secrets (Shortly after we met, she became my chief confidant.)",n.
conflagration,"great fire (The conflagration consumed the entire building.)",n.
confluence,"a gathering together (A confluence of different factors made tonight the perfect night.)",n.
conformist,"one who behaves the same as others (Julian was such a conformist that he had to wait and see if his friends would do something before he would commit.)",n.
confound,"to frustrate, confuse (MacGuyver confounded the policemen pursuing him by covering his tracks.)",v.
congeal,"to thicken into a solid (The sauce had congealed into a thick paste.)",v.
congenial,"pleasantly agreeable (His congenial manner made him popular wherever he went.)",adj.
congregation,"a gathering of people, especially for religious services (The priest told the congregation that he would be retiring.)",n.
congruity,"the quality of being in agreement (Bill and Veronica achieved a perfect congruity of opinion.)",n.
connive,"to plot, scheme (She connived to get me to give up my vacation plans.)",v.
consecrate,"to dedicate something to a holy purpose (Arvin consecrated his spare bedroom as a shrine to Christina.)",v.
consensus,"an agreement of opinion (The jury was able to reach a consensus only after days of deliberation.)",n.
consign,"to give something over to another’s care (Unwillingly, he consigned his mother to a nursing home.)",v.
consolation,"an act of comforting (Darren found Alexandra’s presence to be a consolation for his suffering.)",n.
consonant,"in harmony (The singers’ consonant voices were beautiful.)",adj.
constituent,"an essential part (The most important constituent of her perfume is something called ambergris.)",n.
constrain,"to forcibly restrict (His belief in nonviolence constrained him from taking revenge on his attackers.)",v.
construe,"to interpret (He construed her throwing his clothes out the window as a signal that she wanted him to leave.)",v.
consummate,"to complete a deal; to complete a marriage ceremony through sexual intercourse (Erica and Donald consummated their agreement in the executive boardroom.)",v.
consumption,"the act of consuming (Consumption of intoxicating beverages is not permitted on these premises.)",n.
contemporaneous,"existing during the same time (Though her novels do not feature the themes of Romanticism, Jane Austen’s work was contemporaneous with that of Wordsworth and Byron.)",adj.
contentious,"having a tendency to quarrel or dispute (George’s contentiouspersonality made him unpopular with his classmates.)",adj.
contravene,"to contradict, oppose, violate (Edwidge contravened his landlady’s rule against overnight guests.)",v.
contrite,"penitent, eager to be forgiven (Blake’s contrite behavior made it impossible to stay angry at him.)",adj.
contusion,"bruise, injury (The contusions on his face suggested he’d been in a fight.)",n.
conundrum,"puzzle, problem (Interpreting Jane’s behavior was a constant conundrum.)",n.
convene,"to call together (Jason convened his entire extended family for a discussion.)convention 1. (n.) an assembly of people (The hotel was full because of the cattle￾ranchers’ convention.) 2. (n.) a rule, custom (The cattle-ranchers have a conventionthat you take off your boots before entering their houses.)",v.
convivial,"characterized by feasting, drinking, merriment (The restaurant’s convivial atmosphere put me immediately at ease.)",adj.
convoluted,"intricate, complicated (Grace’s story was so convoluted that I couldn’t follow it.)",adj.
copious,"profuse, abundant (Copious amounts of Snapple were imbibed in the cafeteria.)",adj.
cordial,"warm, affectionate (His cordial greeting melted my anger at once.)",adj.
coronation,"the act of crowning (The new king’s coronation occurred the day after his father’s death.)",n.
corpulence,"extreme fatness (Henry’s corpulence did not make him any less attractive to his charming, svelte wife.)",adj.
corroborate,"to support with evidence (Luke’s seemingly outrageous claim was corroborated by witnesses.)",v.
corrosive,"having the tendency to erode or eat away (The effect of the chemical was highly corrosive.)",adj.
cosmopolitan,"sophisticated, worldly (Lloyd’s education and upbringing were cosmopolitan, so he felt right at home among the powerful and learned.)",adj.
counteract,"to neutralize, make ineffective (The antidote counteracted the effect of the poison.)coup 1. (n.) a brilliant, unexpected act (Alexander pulled off an amazing coup when he got a date with Cynthia by purposely getting hit by her car.) 2. (n.) the overthrow of a government and assumption of authority (In their coup attempt, the army officers stormed the Parliament and took all the legislators hostage.)",v.
covet,"to desire enviously (I coveted Moses’s house, wife, and car.)",v.
covert,"secretly engaged in (Nerwin waged a covertcampaign against his enemies, while outwardly appearing to remain friendly.)",adj.
credulity,"readiness to believe (His credulity made him an easy target for con men.)",n.
crescendo,"a steady increase in intensity or volume (The crescendo of the brass instruments gave the piece a patriotic feel.)",n.
criteria,"standards by which something is judged (Among Mrs. Fields’s criteria for good cookies are that they be moist and chewy.)",n.
culmination,"the climax toward which something progresses (The culmination of the couple’s argument was the decision to divorce.)",n.
culpable,"deserving blame (He was culpable of the crime, and was sentenced to perform community service for 75 years.)",adj.
cultivate,"to nurture, improve, refine (At the library, she cultivated her interest in spy novels.)",v.
cumulative,"increasing, building upon itself (The cumulative effect of hours spent in the sun was a deep tan.)",adj.
cunning,"sly, clever at being deceitful (The general devised a cunning plan to surprise the enemy.)",adj.
cupidity,"greed, strong desire (His cupidity made him enter the abandoned gold mine despite the obvious dangers.)",n.
cursory,"brief to the point of being superficial (Late for the meeting, she cast a cursory glance at the agenda.)",adj.
curt,"abruptly and rudely short (Her curt reply to my question made me realize that she was upset at me.)",adj.
curtail,"to lessen, reduce (Since losing his job, he had to curtail his spending.)D",v.
daunting,"intimidating, causing one to lose courage (He kept delaying the daunting act of asking for a promotion.)",adj.
dearth,"a lack, scarcity (An eager reader, she was dismayed by the dearth of classic books at the library.)",n.
debacle,"a disastrous failure, disruption (The elaborately designed fireworks show turned into a debacle when the fireworks started firing in random directions.)",n.
debase,"to lower the quality or esteem of something (The large raise that he gave himself debased his motives for running the charity.)",v.
debauch,"to corrupt by means of sensual pleasures (An endless amount of good wine and cheese debauched the traveler.)",v.
debunk,"to expose the falseness of something (He debunked her claim to be the world’s greatest chess player by defeating her in 18 consecutive matches.)",v.
decorous,"socially proper, appropriate (The appreciative guest displayed decorousbehavior toward his host.)",adj.
decry,"to criticize openly (The kind video rental clerk decried the policy of charging customers late fees.)",v.
deface,"to ruin or injure something’s appearance (The brothers used eggs and shaving cream to deface their neighbor’s mailbox.)",v.
defamatory,"harmful toward another’s reputation (The defamatory gossip spreading about the actor made the public less willing to see the actor’s new movie.)",adj.
defer,"to postpone something; to yield to another’s wisdom (Ron deferred to Diane, the expert on musical instruments, when he was asked about buying a piano.)",v.
deferential,"showing respect for another’s authority (His deferential attitude toward her made her more confident in her ability to run the company.)",adj.
defile,"to make unclean, impure (She defiled the calm of the religious building by playing her banjo.)",v.
deft,"skillful, capable (Having worked in a bakery for many years, Marcus was a deft bread maker.)",adj.
defunct,"no longer used or existing (They planned to turn the defunct schoolhouse into a community center.)",adj.
delegate,"to hand over responsibility for something (The dean delegated the task of finding a new professor to a special hiring committee.)",v.
deleterious,"harmful (She experienced the deleterious effects of running a marathon without stretching her muscles enough beforehand.)",adj.
deliberate,"intentional, reflecting careful consideration (Though Mary was quite upset, her actions to resolve the dispute were deliberate.)",adj.
delineate,"to describe, outline, shed light on (She neatly delineated her reasons for canceling the project’s funding.)",v.
demagogue,"a leader who appeals to a people’s prejudices (The demagoguestrengthened his hold over his people by blaming immigrants for the lack of jobs.)",n.
demarcation,"the marking of boundaries or categories (Different cultures have different demarcations of good and evil.)",n.
demean,"to lower the status or stature of something (She refused to demean her secretary by making him order her lunch.)",v.
demure,"quiet, modest, reserved (Though everyone else at the party was dancing and going crazy, she remained demure.)",adj.
denigrate,"to belittle, diminish the opinion of (The company decided that its advertisements would no longer denigrate the company’s competitors.)",v.
denounce,"to criticize publicly (The senator denounced her opponent as a greedy politician.)",v.
deplore,"to feel or express sorrow, disapproval (We all deplored the miserable working conditions in the factory.)",v.
depravity,"wickedness (Rumors of the ogre’s depravity made the children afraid to enter the forest.)",n.
deprecate,"to belittle, depreciate (Always over-modest, he deprecated his contribution to the local charity.)",v.
derelict,"abandoned, run-down (Even though it was dangerous, the children enjoyed going to the deserted lot and playing in the derelict house.)",adj.
deride,"to laugh at mockingly, scorn (The bullies derided the foreign student’s accent.)",v. 
derivative,"taken directly from a source, unoriginal (She was bored by his music because she felt that it was derivative and that she had heard it before.)",adj.
desecrate,"to violate the sacredness of a thing or place (They feared that the construction of a golf course would desecrate the preserved wilderness.)",v.
desiccated,"dried up, dehydrated (The skin of the desiccated mummy looked like old paper.)",adj.
desolate,"deserted, dreary, lifeless (She found the desolate landscape quite a contrast to the hustle and bustle of the overcrowded city.)",adj.
despondent,"feeling depressed, discouraged, hopeless (Having failed the first math test, the despondent child saw no use in studying for the next and failed that one too.)",adj.
despot,"one who has total power and rules brutally (The despot issued a death sentence for anyone who disobeyed his laws.)",n.
destitute,"impoverished, utterly lacking (The hurricane destroyed many homes and left many families destitute.)",adj.
deter,"to discourage, prevent from doing (Bob’s description of scary snakes couldn’t deter Marcia from traveling in the rainforests.)",v.
devious,"not straightforward, deceitful (Not wanting to be punished, the deviousgirl blamed the broken vase on the cat.)",adj.
dialect,"a variation of a language (In the country’s remote, mountainous regions, the inhabitants spoke a dialect that the country’s other inhabitants had difficulty understanding.)",n.
diaphanous,"light, airy, transparent (Sunlight poured in through the diaphanouscurtains, brightening the room.)didactic 1. (adj.) intended to instruct (She wrote up a didactic document showing new employees how to handle the company’s customers.) 2. (adj.) overly moralistic (His didacticstyle of teaching made it seem like he wanted to persuade his students not to understand history fully, but to understand it from only one point of view.)",adj.
diffident,"shy, quiet, modest (While eating dinner with the adults, the diffidentyouth did not speak for fear of seeming presumptuous.)diffuse 1. (v.) to scatter, thin out, break up (He diffused the tension in the room by making in a joke.) 2. (adj.) not concentrated, scattered, disorganized (In her writings, she tried unsuccessfully to make others understand her diffuse thoughts.)",adj.
dilatory,"tending to delay, causing delay (The general’s dilatory strategy enabled the enemy to regroup.)",adj.
diligent,"showing care in doing one’s work (The diligent researcher made sure to check her measurements multiple times.)",adj.
diminutive,"small or miniature (The bullies, tall and strong, picked on the diminutive child.)",adj.
dirge,"a mournful song, especially for a funeral (The bagpipers played a dirge as the casket was carried to the cemetery.)",n.
disaffected,"rebellious, resentful of authority (Dismayed by Bobby’s poor behavior, the parents sent their disaffected son to a military academy to be disciplined.)",adj.
disavow,"to deny knowledge of or responsibility for (Not wanting others to criticize her, she disavowed any involvement in the company’s hiring scandal.)",v.
discern,"to perceive, detect (Though he hid his emotions, she discerned from his body language that he was angry.)",v.
disclose,"to reveal, make public (The CEO disclosed to the press that the company would have to fire several employees.)",v.
discomfit,"to thwart, baffle (The normally cheery and playful children’s sudden misery discomfited the teacher.)",v.
discordant,"not agreeing, not in harmony with (The girls’ sobs were a discordantsound amid the general laughter that filled the restaurant.)",adj.
discrepancy,"difference, failure of things to correspond (He was troubled by the discrepancy between what he remembered paying for the appliance and what his receipt showed he paid for it.)",n.
discretion,"the quality of being reserved in speech or action; good judgment (Not wanting her patient to get overly anxious, the doctor used discretion in deciding how much to tell the patient about his condition.)",n.
discursive,"rambling, lacking order (The professor’s discursive lectures seemed to be about every subject except the one initially described.)disdain 1. (v.) to scorn, hold in low esteem (Insecure about their jobs, the older employees disdained the recently hired ones, who were young and capable.) 2. (n.)scorn, low esteem (After learning of his immoral actions, Justine held Lawrence in disdain.)",adj.
disgruntled,"upset, not content (The child believed that his parents had unjustly grounded him, and remained disgruntled for a week.)",adj.
disheartened,"feeling a loss of spirit or morale (The team was disheartened after losing in the finals of the tournament.)",adj.
disparage,"to criticize or speak ill of (The saleswoman disparaged the competitor’s products to persuade her customers to buy what she was selling.)",v.
disparate,"sharply differing, containing sharply contrasting elements (Having widely varying interests, the students had disparate responses toward the novel.)",adj.
dispatch,"to send off to accomplish a duty (The carpenter dispatched his assistant to fetch wood.)",v.
dispel,"to drive away, scatter (She entered the office as usual on Monday, dispellingthe rumor that she had been fired.)",v. 
disperse,"to scatter, cause to scatter (When the rain began to pour, the crowd at the baseball game quickly dispersed.)",v.
disrepute,"a state of being held in low regard (The officer fell into disrepute after it was learned that he had disobeyed the orders he had given to his own soldiers.)",n.
dissemble,"to conceal, fake (Not wanting to appear heartlessly greedy, she dissembled and hid her intention to sell her ailing father’s stamp collection.)",v. 
