word,definition,part of speech
palette,"a range of colors or qualities (The palette of colors utilized in the painting was equaled only by the range of intense emotions the piece evoked.)",adj.
palliate,"to reduce the severity of (The doctor trusted that the new medication would palliate her patient’s discomfort.)",v. 
pallid,"lacking color (Dr. Van Helsing feared that Lucy’s pallid complexion was due to an unexplained loss of blood.)",adj.
panacea,"a remedy for all ills or difficulties (Doctors wish there was a single panaceafor every disease, but sadly there is not.)",n.
paradigm,"an example that is a perfect pattern or model (Because the new SUV was so popular, it became the paradigm upon which all others were modeled.)",n.
paradox,"an apparently contradictory statement that is perhaps true (The diplomat refused to acknowledge the paradox that negotiating a peace treaty would demand more resources than waging war.)",n.
paragon,"a model of excellence or perfection (The mythical Helen of Troy was considered a paragon of female beauty.)",n.
paramount,"greatest in importance, rank, character (It was paramount that the bomb squad disconnect the blue wire before removing the fuse.)",adj.
pariah,"an outcast (Following the discovery of his plagiarism, Professor Hurley was made a pariah in all academic circles.)",n.
parody,"a satirical imitation (A hush fell over the classroom when the teacher returned to find Deborah acting out a parody of his teaching style.)",n.
parsimony,"frugality, stinginess (Many relatives believed that my aunt’s wealth resulted from her parsimony.)",n. 
partisan,"a follower, adherent (The king did not believe that his rival could round up enough partisans to overthrow the monarchy.)",n.
patent,"readily seen or understood, clear (The reason for Jim’s abdominal pain was made patent after the doctor performed a sonogram.)",adj. 
pathology,"a deviation from the normal (Dr. Hastings had difficulty identifying the precise nature of Brian’s pathology.)",n.
pathos,"an emotion of sympathy (Martha filled with pathos upon discovering the scrawny, shivering kitten at her door.)",n.
paucity,"small in quantity (Gilbert lamented the paucity of twentieth century literature courses available at the college.)",adj.
pejorative,"derogatory, uncomplimentary (The evening’s headline news covered an international scandal caused by a pejorative statement the famous senator had made in reference to a foreign leader.)",adj. 
pellucid,"easily intelligible, clear (Wishing his book to be pellucid to the common man, Albert Camus avoided using complicated grammar when composing The Stranger.)",adj. 
penchant,"a tendency, partiality, preference (Jill’s dinner parties quickly became monotonous on account of her penchant for Mexican dishes.)",n.
penitent,"remorseful, regretful (The jury’s verdict may have been more lenient if the criminal had appeared penitent for his gruesome crimes.)",adj.
penultimate,"next to last (Having smoked the penultimate cigarette remaining in the pack, Cybil discarded the last cigarette and resolved to quit smoking.)",adj.
penurious,"miserly, stingy (Stella complained that her husband’s penurious ways made it impossible to live the lifestyle she felt she deserved.)",adj.
perfidious,"disloyal, unfaithful (After the official was caught selling government secrets to enemy agents, he was executed for his perfidious ways.)",adj.
perfunctory,"showing little interest or enthusiasm (The radio broadcaster announced the news of the massacre in a surprisingly perfunctory manner.)",adj.
permeate,"to spread throughout, saturate (Mrs. Huxtable was annoyed that the wet dog’s odor had permeated the furniture’s upholstery.)",v. 
pernicious,"extremely destructive or harmful (The new government feared that the Communist sympathizers would have a pernicious influence on the nation’s stability.)",adj. 
perplex,"to confuse (Brad was perplexed by his girlfriend’s suddenly distant manner.)",v. 
perspicacity,"shrewdness, perceptiveness (The detective was too humble to acknowledge that his perspicacity was the reason for his professional success.)",adj.
pert,"flippant, bold (My parents forgave Sandra’s pert humor at the dinner table because it had been so long since they had last seen her.)",adj. 
pertinacious,"stubbornly persistent (Harry’s parents were frustrated with his pertinacious insistence that a monster lived in his closet. Then they opened the closet door and were eaten.)",adj.
perusal,"a careful examination, review (The actor agreed to accept the role after a two-month perusal of the movie script.)",n.
pervasive,"having the tendency to spread throughout (Stepping off the plane in Havana, I recognized the pervasive odor of sugar cane fields on fire.)",adj. 
petulance,"rudeness, irritability (The Nanny resigned after she could no longer tolerate the child’s petulance.)",n.
philanthropic,"charitable, giving (Many people felt that the billionaire’s decision to donate her fortune to house the homeless was the ultimate philanthropic act.)",adj. 
phlegmatic,"uninterested, unresponsive (Monique feared her dog was ill after the animal’s phlegmatic response to his favorite chew toy.)",adj.
pillage,"to seize or plunder, especially in war (Invading enemy soldiers pillaged the homes scattered along the country’s border.)",v. 
pinnacle,"the highest point (Book reviewers declared that the author’s new novel was extraordinary and probably the pinnacle ofWestern literature.)",n. 
pithy,"concisely meaningful (My father’s long-winded explanation was a stark contrast to his usually pithy statements.)",adj. 
pittance,"a very small amount, especially relating to money (Josh complained that he was paid a pittance for the great amount of work he did at the firm.)",n.
placate,"to ease the anger of, soothe (The man purchased a lollipop to placate his irritable son.)",v.
placid,"calm, peaceful (The placid lake surface was as smooth as glass.)",adj.
platitude,"an uninspired remark, cliché (After reading over her paper, Helene concluded that what she thought were profound insights were actually just platitudes.)",n. 
plaudits,"enthusiastic approval, applause (The controversial new film received plaudits from even the harshest critics.)",n.
plausible,"believable, reasonable (He studied all the data and then came up with a plausible theory that took all factors into account.)",adj.
plenitude,"an abundance (My grandmother was overwhelmed by the plenitude of tomatoes her garden yielded this season.)",n.
plethora,"an abundance, excess (The wedding banquet included a plethora of oysters piled almost three feet high.)",n.
pliable,"flexible (Aircraft wings are designed to be somewhat pliable so they do not break in heavy turbulence.)",adj.
poignant,"deeply affecting, moving (My teacher actually cried after reading to us the poignant final chapter of the novel.)",adj.
polemic,"an aggressive argument against a specific opinion (My brother launched into a polemic against my arguments that capitalism was an unjust economic system.)",n.
portent,"an omen (When a black cat crossed my sister’s path while she was walking to school, she took it as a portent that she would do badly on her spelling test.)",n. 
potable,"suitable for drinking (During sea voyages it is essential that ships carry a supply of potable water because salty ocean water makes anyone who drinks it sick.)",adj.
potentate,"one who has great power, a ruler (All the villagers stood along the town’s main road to observe as the potentate’s procession headed towards the capital.)",n. 
pragmatic,"practical (The politician argued that while increased security measures might not fit with the lofty ideals of the nation, they were a pragmatic necessity to ensure everyone’s safety.)",adj. 
precipice,"the face of a cliff, a steep or overhanging place (The mountain climber hung from a precipice before finding a handhold and pulling himself up.)",n.
preclude,"to prevent (My grandfather’s large and vicious guard dog precludedanyone from entering the yard.)",v. 
precocious,"advanced, developing ahead of time (Derek was so academically precocious that by the time he was 10 years old, he was already in the ninth grade.)",adj.
predilection,"a preference or inclination for something (Francois has a predilectionfor eating scrambled eggs with ketchup, though I prefer to eat eggs without any condiments.)",n. 
preponderance,"superiority in importance or quantity (Britain’s preponderance of naval might secured the nation’s role as a military power.)",adj. 
prepossessing,"occupying the mind to the exclusion of other thoughts or feelings (His prepossessing appearance made it impossible for me to think of anything else.)",adj.
presage,"an omen (When my uncle’s old war injury ached, he interpreted it as a presage of bad weather approaching.)",n. 
prescient,"to have foreknowledge of events (Questioning the fortune cookie’s prediction, Ray went in search of the old hermit who was rumored to be prescient.)",adj. 
prescribe,"to lay down a rule (The duke prescribed that from this point further all of the peasants living on his lands would have to pay higher taxes.)",v.
presumptuous,"disrespectfully bold (The princess grew angry after the presumptuous noble tried to kiss her, even though he was far below her in social status.)",adj. 
pretense,"an appearance or action intended to deceive (Though he actually wanted to use his parents’ car to go on a date, Nick borrowed his parents’ car under the pretense of attending a group study session.)",n.
primeval,"original, ancient (The first primates to walk on two legs, called Australopithecus, were the primeval descendants of modern man.)",adj. 
privation,"lacking basic necessities (After decades of rule by an oppressive government that saw nothing wrong with stealing from its citizens, the recent drought only increased the people’s privation.)",n.
probity,"virtue, integrity (Because he was never viewed as a man of great probity, no one was surprised by Mr. Samson’s immoral behavior.)",n. 
proclivity,"a strong inclination toward something (In a sick twist of fate, Harold’s childhood proclivity for torturing small animals grew into a desire to become a surgeon.)",n. 
procure,"to obtain, acquire (The FBI was unable to procure sufficient evidence to charge the gangster with racketeering.)",v.
profane,"lewd, indecent (Jacob’s profane act of dumping frogs in the holy water in the chapel at his boarding school resulted in his dismissal.)",adj. 
profligate,"dissolute, extravagant (The profligate gambler loved to drink, spend money, steal, cheat, and hang out with prostitutes.)",adj. 
profuse,"plentiful, abundant (The fans were profuse in their cheers for the star basketball player.)",adj.
promulgate,"to proclaim, make known (The film professor promulgated that both in terms of sex appeal and political intrigue, Sean Connery’s James Bond was superior to Roger Moore’s.)",v. 
propagate,"to multiply, spread out (Rumors of Paul McCartney’s demise propagatedlike wildfire throughout the world.)",v. 
propensity,"an inclination, preference (Dermit has a propensity for dangerous activities such as bungee jumping.)",n. 
propitious,"favorable (The dark storm clouds visible on the horizon suggested that the weather would not be propitious for sailing.)",adj.
propriety,"the quality or state of being proper, decent (Erma’s old-fashioned parents believed that her mini-skirt lacked the propriety expected of a “nice” girl.)",n. 
prosaic,"plain, lacking liveliness (Heather’s prosaic recital of the poem bored the audience.)",adj.
proscribe,"to condemn, outlaw (The town council voted to proscribe the sale of alcohol on weekends.)",v.
protean,"able to change shape; displaying great variety (Among Nigel’s proteantalents was his ability to touch the tip of his nose with his tongue.)",adj. 
prowess,"extraordinary ability (The musician had never taken a guitar lesson in his life, making his prowess with the instrument even more incredible.)",n. 
prudence,"cautious, circumspect (After losing a fortune in a stock market crash, my father vowed to practice greater prudence in future investments.)",n. 
prurient,"eliciting or possessing an extraordinary interest in sex (David’s mother was shocked by the discovery of prurient reading material hidden beneath her son’s mattress.)",adj. 
puerile,"juvenile, immature (The judge demanded order after the lawyer’s puerileattempt to object by stomping his feet on the courtroom floor.)",adj. 
pugnacious,"quarrelsome, combative (Aaron’s pugnacious nature led him to start several barroom brawls each month.)",adj.
pulchritude,"physical beauty (Several of Shakespeare’s sonnets explore the pulchritude of a lovely young man.)",n.
punctilious,"eager to follow rules or conventions (Punctilious Bobby, hall monitor extraordinaire, insisted that his peers follow the rules.)",adj.
pungent,"having a pointed, sharp quality—often used to describe smells (The pungent odor in the classroom made Joseph lose his concentration during the test.)",adj.
punitive,"involving punishment (If caught smoking in the boys’ room, the punitiveresult is immediate expulsion from school.)",adj.
putrid,"rotten, foul (Those rotten eggs smell putrid.)Q",adj.
quagmire,"a difficult situation (We’d all like to avoid the kind of military quagmirecharacterized by the Vietnam War.)",n.
quaint,"charmingly old-fashioned (Hilda was delighted by the quaint bonnets she saw in Amish country.)",adj.
quandary,"a perplexed, unresolvable state (Carlos found himself in a quandary: should he choose mint chocolate chip or cookie dough?)",n.
quell,"to control or diffuse a potentially explosive situation (The skilled leader deftly quelled the rebellion.)",v.
querulous,"whiny, complaining (If deprived of his pacifier, young Brendan becomes querulous.)",adj.
quixotic,"idealistic, impractical (Edward entertained a quixotic desire to fall in love at first sight in a laundromat.)",adj.
quotidian,"daily (Ambika’s quotidian routines include drinking two cups of coffee in the morning.)R",adj.
rail,"to scold, protest (The professor railed against the injustice of the college’s tenure policy.)",v.
rancid,"having a terrible taste or smell (Rob was double-dog-dared to eat the rancid egg salad sandwich.)",adj.
rancor,"deep, bitter resentment (When Eileen challenged me to a fight, I could see the rancor in her eyes.)",n.
rapport,"mutual understanding and harmony (When Margaret met her paramour, they felt an instant rapport.)",n.
rash,"hasty, incautious (It’s best to think things over calmly and thoroughly, rather than make rash decisions.)",adj. 
raucous,"loud, boisterous (Sarah’s neighbors called the cops when her house party got too raucous.)",adj.
raze,"to demolish, level (The old tenement house was razed to make room for the large chain store.)",v.
rebuke,"to scold, criticize (When the cops showed up at Sarah’s party, they rebukedher for disturbing the peace.)",v.
recalcitrant,"defiant, unapologetic (Even when scolded, the recalcitrant young girl simply stomped her foot and refused to finish her lima beans.)",adj.
recapitulate,"to sum up, repeat (Before the final exam, the teacher recapitulated the semester’s material.)",v.
reciprocate,"to give in return (When Steve gave Samantha a sweater for Christmas, she reciprocated by giving him a kiss.)",v.
reclusive,"solitary, shunning society (Reclusive authors such as J.D. Salinger do not relish media attention and sometimes even enjoy holing up in remote cabins in the woods.)reconcile 1. (v.) to return to harmony (The feuding neighbors finally reconciled when one brought the other a delicious tuna noodle casserole.) 2. (v.) to make consistent with existing ideas (Alou had to reconcile his skepticism about the existence of aliens with the fact that he was looking at a flying saucer.)",adj.
rectitude,"uprightness, extreme morality (The priest’s rectitude gave him the moral authority to counsel his parishioners.)redoubtable 1. (adj.) formidable (The fortress looked redoubtable set against a stormy sky.) 2. (adj.) commanding respect (The audience greeted the redoubtable speaker with a standing ovation.)",n.
refract,"to distort, change (The light was refracted as it passed through the prism.)",v.
refurbish,"to restore, clean up (The dingy old chair, after being refurbished, commanded the handsome price of $200.)",v.
refute,"to prove wrong (Maria refuted the president’s argument as she yelled and gesticulated at the TV.)regurgitate 1. (v.) to vomit (Feeling sick, Chuck regurgitated his dinner.) 2. (v.) to throw back exactly (Margaret rushed through the test, regurgitating all of the facts she’d memorized an hour earlier.)relegate 1. (v.) to assign to the proper place (At the astrology conference, Simon was relegated to the Scorpio room.) 2. (v.) to assign to an inferior place (After spilling a drink on a customer’s shirt, the waiter found himself relegated to the least lucrative shift.)",v. 
relish,"to enjoy (Pete always relished his bedtime snack.)",v.
remedial,"intended to repair gaps in students’ basic knowledge (After his teacher discovered he couldn’t read, Alex was forced to enroll in remedial English.)",adj.
remiss,"negligent, failing to take care (The burglar gained entrance because the security guard, remiss in his duties, forgot to lock the door.)renovate 1. (v.) restore, return to original state (The renovated antique candelabra looked as good as new.) 2. (v.) to enlarge and make prettier, especially a house (After getting renovated, the house was twice as big and much more attractive.)",adj. 
renown,"honor, acclaim (The young writer earned international renown by winning the Pulitzer Prize.)",n.
renunciation,"to reject (Fiona’s renunciation of red meat resulted in weight loss, but confused those people who thought she’d been a vegetarian for years.)",n.
repentant,"penitent, sorry (The repentant Dennis apologized profusely for breaking his mother’s vase.)",adj.
replete,"full, abundant (The unedited version was replete with naughty words.)",adj.
repose,"to rest, lie down (The cat, after eating an entire can of tuna fish, reposed in the sun and took a long nap.)",v.
reprehensible,"deserving rebuke (Jean’s cruel and reprehensible attempt to dump her boyfriend on his birthday led to tears and recriminations.)",adj.
reprieve,"a temporary delay of punishment (Because the governor woke up in a particularly good mood, he granted hundreds of reprieves to prisoners.)",n.
reproach,"to scold, disapprove (Brian reproached the customer for failing to rewind the video he had rented.)",v.
reprobate,"evil, unprincipled (The reprobate criminal sat sneering in the cell.)",adj.
reprove,"to scold, rebuke (Lara reproved her son for sticking each and every one of his fingers into the strawberry pie.)",v.
repudiate,"to reject, refuse to accept (Kwame made a strong case for an extension of his curfew, but his mother repudiated it with a few biting words.) repulse 1. (v.) to disgust (Antisocial Annie tried to repulse people by neglecting to brush her teeth.) 2. (v.) to push back (With a deft movement of her wrist and a punch to the stomach, Lacy repulsed Jack’s attempt to kiss her.)",v.
reputable,"of good reputation (After the most reputable critic in the industry gave the novel a glowing review, sales took off.)",adj.
requisition,"a demand for goods, usually made by an authority (During the war, the government made a requisition of supplies.)",n.
rescind,"to take back, repeal (The company rescinded its offer of employment after discovering that Jane’s resume was full of lies.)reservoir 1. (n.) reserves, large supply (Igor the Indomitable had quite a reservoir of strengh and could lift ten tons, even after running 700 miles, jumping over three mountains, and swimming across an ocean.) 2. (n.) a body of water used for storing water (After graduation, the more rebellious members of the senior class jumped into the town reservoir used for drinking water.)",v.
resilient,"able to recover from misfortune; able to withstand adversity (The resilient ballplayer quickly recovered from his wrist injury.)",adj.
resolute,"firm, determined (With a resolute glint in her eye, Catherine announced that she was set on going to college in New York City even though she was a little frightened of tall buildings.)resolve 1. (v.) to find a solution (Sarah and Emma resolved their differences and shook hands.) 2. (v.) to firmly decide (Lady Macbeth resolved to whip her husband into shape.)",adj.
respite,"a break, rest (Justin left the pub to gain a brief respite from the smoke and noise.)",n.
resplendent,"shiny, glowing (The partygoers were resplendent in diamonds and fancy dress.)",adj.
restitution,"restoration to the rightful owner (Many people feel that descendants of slaves should receive restitution for the sufferings of their ancestors.)",n.
restive,"resistant, stubborn, impatient (The restive audience pelted the band with mud and yelled nasty comments.)",adj.
retract,"withdraw (As the media worked itself into a frenzy, the publicist hurriedly retracted his client’s sexist statement.)",v. 
revel,"to enjoy intensely (Theodore reveled in his new status as Big Man on Campus.)",v.
revere,"to esteem, show deference, venerate (The doctor saved countless lives with his combination of expertise and kindness and became universally revered.)",v.
revoke,"to take back (After missing the curfew set by the court for eight nights in a row, Marcel’s freedom of movement was revoked.)",v.
rhapsodize,"to engage in excessive enthusiasm (The critic rhapsodized about the movie, calling it an instant classic.)",v.
ribald,"coarsely, crudely humorous (While some giggled at the ribald joke involving a parson’s daughter, most sighed and rolled their eyes.)",adj.
rife,"abundant (Surprisingly, the famous novelist’s writing was rife with spelling errors.)",adj.
ruminate,"to contemplate, reflect (Terry liked to ruminate while sitting on the banks of the river, staring pensively into the water.)",v.
ruse,"a trick (Oliver concocted an elaborate ruse for sneaking out of the house to meet his girlfriend while simultaneously giving his mother the impression that he was asleep in bed.)S",n.
saccharine,"sickeningly sweet (Tom’s saccharine manner, although intended to make him popular, actually repelled his classmates.)",adj.
sacrosanct,"holy, something that should not be criticized (In the United States, the Constitution is often thought of as a sacrosanct document.)",adj.
sagacity,"shrewdness, soundness of perspective (With remarkable sagacity, the wise old man predicted and thwarted his children’s plan to ship him off to a nursing home.)",n.
salient,"significant, conspicuous (One of the salient differences between Alison and Nancy is that Alison is a foot taller.)",adj.
salutation,"a greeting (Andrew regularly began letters with the bizarre salutation“Ahoy ahoy.”)",n.
salve,"a soothing balm (After Tony applied a salve to his brilliant red sunburn, he soon felt a little better.)",n.
sanctimonious,"giving a hypocritical appearance of piety (The sanctimoniousBertrand delivered stern lectures on the Ten Commandments to anyone who would listen, but thought nothing of stealing cars to make some cash on the side.)",adj.
sanguine,"optimistic, cheery (Polly reacted to any bad news with a sanguine smile and the chirpy cry, “When life hands you lemons, make lemonade!”)",adj.
satiate,"to satisfy excessively (Satiated after eating far too much turkey and stuffing, Liza lay on the couch watching football and suffering from stomach pains.)",v.
scathing,"sharp, critical, hurtful (Two hours after breaking up with Russell, Suzanne thought of the perfect scathing retort to his accusations.)",adj.
scintillating,"sparkling (The ice skater’s scintillating rhinestone costume nearly blinded the judges.)",adj.
scrupulous,"painstaking, careful (With scrupulouscare, Sam cut a snowflake out of white paper.)",adj.
scurrilous,"vulgar, coarse (When Bruno heard the scurrilous accusation being made about him, he could not believe it because he always tried to be nice to everyone.)",adj.
sedentary,"sitting, settled (The sedentary cat did little but loll in the sun.)",adj.
semaphore,"a visual signal (Anne and Diana communicated with a semaphoreinvolving candles and window shades.)",n.
seminal,"original, important, creating a field (Stephen Greenblatt’s essays on Shakespeare proved to be seminal, because they initiated the critical school of New Historicism.)",adj.
sensual,"involving sensory gratification, usually related to sex (With a coy smile, the guest on the blind-date show announced that he considered himself a very sensual person.)",adj.
sensuous,"involving sensory gratification (Paul found drinking Coke, with all the little bubbles bursting on his tongue, a very sensuous experience.)",adj.
serendipity,"luck, finding good things without looking for them (In an amazing bit of serendipity, penniless Paula found a $20 bill in the subway station.)",n.
serene,"calm, untroubled (Louise stood in front of the Mona Lisa, puzzling over the famous woman’s serene smile.)",adj.
servile,"subservient (The servile porter crept around the hotel lobby, bowing and quaking before the guests.)",adj. 
sinuous,"lithe, serpentine (With the sinuous movements of her arms, the dancer mimicked the motion of a snake.)",adj.
sobriety,"sedate, calm (Jason believed that maintaining his sobriety in times of crisis was the key to success in life.)",n.
solicitous,"concerned, attentive (Jim, laid up in bed with a nasty virus, enjoyed the solicitous attentions of his mother, who brought him soup and extra blankets.)",adj.
solipsistic,"believing that oneself is all that exists (Colette’s solipsistic attitude completely ignored the plight of the homeless people on the street.)",adj.
